category,title,excerpt,date,link,author,content,image
metro-plus,Guards foil suspect’s attempt to raid Lagos bank,"A team of security guards has foiled an attempted robbery on a new-generation bank in the Mushin area of Lagos State. PUNCH Metro gathered that the incident happened on Tuesday, September 26, 2023, ar...",6th October 2023,https://punchng.com/guards-foil-suspects-attempt-to-raid-lagos-bank/,Dayo Oyewo,"A team of security guards has foiled an attempted robbery on a new-generation bank in the Mushin area of Lagos State.
PUNCH Metro gathered that the incident happened on Tuesday, September 26, 2023, around 10pm.
It was learnt that the robber bypassed the main entrance of the bank and gained entry into the banking hall through the ceiling.
A police source in the area who spoke on condition of anonymity told our correspondent that the yet-to-be-identified suspect was caught wearing a face mask when he perpetrated the act. 
The source said, “An unknown person wearing a face mask entered the banking hall through the ceiling around 10pm. The moment he gained entry, he went straight to the cash and teller section of the bank.
“It was one of the security operatives on night duty who heard a noise in the banking hall. He went in, traced the sound and saw someone with a covered face, ransacking the teller section of the bank. The moment the robber saw him, he quickly rushed to the point where he came in from and escaped through the ceiling.”  Related News   Lagos-Abeokuta expressway remains a death trap, motorists lament  BRT bus crushes three to death in Lagos  Police recover car stolen from Anambra in Lagos   
The police source said his colleagues, after being contacted, went to the bank around 1am, cordoned off the area and began to search for the suspect.      
“When policemen got to the bank, they searched the banking hall and the ceiling. They also searched the generator house but the suspect could not be found. The search went on through the morning but no progress was made to locate the suspect.
“In the process of intensifying their search, the footprints of the suspects were seen and it was discovered that he escaped from the roof to the next building,” he added.
Our correspondent gathered that no loss or damage was recorded after taking inventory of the bank’s properties.
The state Police Public Relations Officer, Benjamin Hundeyin, confirmed the incident on Wednesday.
“It happened and the investigation is ongoing,” he said.",https://cdn.punchng.com/wp-content/uploads/2023/01/06222905/HUNDEYIN.jpg
metro-plus,"Lagos task force impounds 35 vehicles, demolishes shanties","The Lagos State Task Force has impounded 35 vehicles for illegal parking and road obstruction along the Jibowu corridor in the Yaba area of the state. The task force’s spokesperson, Gbadeyan Abdulra...",6th October 2023,https://punchng.com/lagos-task-force-impounds-35-vehicles-demolishes-shanties/,Gbenga Oloniniran and Toyosi Sanusi,"The Lagos State Task Force has impounded 35 vehicles for illegal parking and road obstruction along the Jibowu corridor in the Yaba area of the state.
The task force’s spokesperson, Gbadeyan Abdulraheem, in a statement on Thursday, said the operation took place on Wednesday and was coordinated by the agency’s chairman, CSP Shola Jejeloye, who described the actions of some transport operators as “self-cantered” for occupying a large portion of the road to load goods on their vehicles and pick up passengers.
According to Abdulraheem, Jejeloye disclosed that residents and commuters who ply the route complained of the activities of the bus operators at Jibowu “who converted those areas to roadside courier stations and mini garages.”
“It is sad to see these transport operators move their business from their premises down to the main road meant for free vehicular movement just for their selfish gains. 
“Their actions cause increased travel time and unnecessary chaos once it gets dark,” the statement quoted Jejeloye as saying.
The chairman further disclosed that the vehicles impounded had been booked and the owners would be made to face the full wrath of the law.
“It’s high time we put a stop to this inhumanity to Lagosians plying that route. We will ensure constant patrol and monitoring of the Jibowu corridor especially at night when such infractions usually occur and make sure anyone caught inflicting unnecessary discomfort to road users is arrested and charged to court,” he added.        Related News   Govt demolishes Apapa port shanties, sacks hoodlums  Lagos task force returns N100,000 after PUNCH report  Lagos: Fire guts shanties in Ebute Metta   
Meanwhile, officials of the Lagos State Task Force on Thursday demolished shanties and makeshift structures around the Lekki-Epe area.
The operation was carried out around Ikota, Eleganza Bus Stop.
According to a post on X (formerly Twitter), the shanties and makeshift structures defaced the expressway and were also said to be dens of criminals in the area.
Officials of the task force were said to have faced opposition from some individuals who initially stalled the operation.
When contacted, the task force Public Relations Officer, Abdulraheem, confirmed the operation which he said targeted only shanties that were against the “New Lagos status.”
He said, “Given the agenda of the state, we don’t want that kind of thing in New Lagos mega city status, shanties were demolished, not buildings.”",https://cdn.punchng.com/wp-content/uploads/2023/10/05234800/DEMOLITION-SCENE.jpg
metro-plus,BRT bus crushes three to death in Lagos,The Lagos State Police Command has confirmed that three persons died after the two motorcycles they were riding on collided with a BRT vehicle in the Alakija area of Lagos. In a video that went vira...,6th October 2023,https://punchng.com/brt-bus-crushes-three-to-death-in-lagos/,Amarachi Okey and Gbenga Oloniniran,"The Lagos State Police Command has confirmed that three persons died after the two motorcycles they were riding on collided with a BRT vehicle in the Alakija area of Lagos.
In a video that went viral on social media on Thursday, a voice was heard advising residents to avoid using motorcycles and BRT lanes. “Please my brothers and sisters, avoid taking the BRT lane. If you enter Okada, don’t allow the Okada to follow the BRT lane. Three people just died,” the voice said.
In the video, three bodies were seen on the floor in front of the BRT bus that had its front damaged while one of the motorcycles was seen under the BRT.  Related News   Lagos-Abeokuta expressway remains a death trap, motorists lament  Guards foil suspect’s attempt to raid Lagos bank  Police recover car stolen from Anambra in Lagos   
PUNCH Metro gathered that the victims were on their way home on Wednesday in the area when their motorcycles rammed into the BRT.
It was further learnt that angry youths attempted to raze the BRT vehicle but were prevented by policemen who arrived at the scene.
Confirming the incident to PUNCH Metro on Thursday, the state Police Public Relations Officer, Benjamin Hundeyin, said, “Yes, the accident happened yesterday (Wednesday) around 5pm.”",https://cdn.punchng.com/wp-content/uploads/2021/10/27200038/Lagos-BRT-lane.jpg
metro-plus,Steward bags life imprisonment for defiling employer’s children,"A steward, Happiness Sunday, was on Thursday convicted and sentenced to life imprisonment for sexually assaulting his employer’s children, who are aged 10 and eight. Justice Abiola Soladoye handed d...",6th October 2023,https://punchng.com/steward-bags-life-imprisonment-for-defiling-employers-children/,Solomon Odeniyi,"A steward, Happiness Sunday, was on Thursday convicted and sentenced to life imprisonment for sexually assaulting his employer’s children, who are aged 10 and eight.
Justice Abiola Soladoye handed down the life sentence to Sunday, who had served as both steward and gateman with the family of the victims.
The judge sentenced him to life imprisonment on each of the three counts which bordered on defilement and sexual assault by penetration.
Soladoye held that the prosecution was able to prove the charges against the convict. 
She further held that the ingredients of defilement and sexual assault by penetration were thoroughly satisfied under Sections 137 and 261 of the Criminal Law of the Lagos State.
According to her, the convict was a bisexual houseboy who was desperate and wicked.
She said, “The defendant is a sexual terrorist who ravished children.        Related News   Foundation offers N7.6m in scholarships for underprivileged children  Diphtheria: Group decries poor funding, vaccination in Nigeria  Housekeeper jailed 14 years for stealing from employer   
“He is a disloyal worker, egoistic, a terrible person whose sexual perversion is unacceptable.
“His actions are beastly and should be locked away for life because his conduct is utterly disgraceful.”
The court also urged parents to be watchful and the care for children should never be taken lightly.
Soladoye thereafter sentenced the convict to life imprisonment on each of the three counts.
The judge held that the sentencing should run concurrently and the convict should have his name registered in the Lagos State Sexual Offences Register.
The state prosecution counsel, Mrs Olufunke Adegoke, during the trial called four witnesses and tendered three exhibits in proof of the case while the convict testified as sole witness.
The prosecution said the defendant committed the offences in 2020 on Jaye Oyedotun Street, Magodo, Lagos.",https://cdn.punchng.com/wp-content/uploads/2023/06/09133934/court-tool.jpeg
metro-plus,UNICAL lecturer accused of sexual harassment arrested,The Department of State Services on Thursday said its operatives collaborated with officials of the Independent Corrupt Practices and Other Related Offences Commission to arrest Prof Cyril Ndifon who ...,6th October 2023,https://punchng.com/unical-lecturer-accused-of-sexual-harassment-arrested/,Solomon Odeniyi,"The Department of State Services on Thursday said its operatives collaborated with officials of the Independent Corrupt Practices and Other Related Offences Commission to arrest Prof Cyril Ndifon who was recently accused of sexually harassing law students at the University of Calabar.
The service said Ndifon was arrested after shunning several invitations extended to him.
This is, however, contrary to a report (not by The PUNCH) claiming he was abducted by gunmen.
The report quoted his wife as saying her husband was kidnapped in the early hours of Wednesday. 
However, a statement by the DSS titled, “ICPC seeks DSS collaboration on the UNICAL sex scandal matter” noted that the ICPC arrested him on October 4, following a court order.
The Director, Public Relations and Strategic Communications, the DSS National Headquarters, Peter Afunanya, said Ndifon was arrested with the support of the DSS.  Related News   Sagamu killings: Ogun Assembly urges DSS to release member  Ogun lawmaker spends over 14-day in DSS custody, assembly kicks  Sex Scandal: Why UNICAL Prof was arrested — DSS   
The statement read, “The ICPC has sought the collaboration of the Department of State Services on the University of Calabar sex scandal matter involving Prof Cyril Ndifon, the erstwhile Dean of the Faculty of Law of the institution.      
“The commission had disclosed the refusal of Ndifon to honour its several invitations, thus his eventual arrest in Calabar, Cross River State by its operatives on October 4, 2023, was based on a court order.
“However, the Service, following the commission’s request and in the spirit of interagency cooperation, supported it for a successful operation.
“This is to guide public understanding of the latest developments on the matter.”
The institution’s Faculty of Law students protested in front of the Vice Chancellor’s office on August 14, 2023, accusing the former dean of sexual harassment, extortion, and high-handedness among others.",https://cdn.punchng.com/wp-content/uploads/2016/09/25192810/Prof.-Cyril-Ndifon.jpg
metro-plus,Traders fear disease outbreak over refuse in Ogun market,"Traders in Agunloye Market in Ado, the Ado-Odo Ota Local Government Area of Ogun State have appealed to relevant government agencies to clear the heap of refuse in the market. They said if left unatte...",6th October 2023,https://punchng.com/traders-fear-disease-outbreak-over-refuse-in-ogun-market/,Johnson Idowu,"Traders in Agunloye Market in Ado, the Ado-Odo Ota Local Government Area of Ogun State have appealed to relevant government agencies to clear the heap of refuse in the market.
They said if left unattended to, the situation may lead to an outbreak of diseases in the market.
When our correspondent visited the market on Thursday, it was observed that the heap of refuse was located at the centre of the market with stench oozing from it.
The market leader of Ado-Odo, Babatunde Bakare, noted that the stench coming from the refuse heap has deterred customers from patronising the market while residents in the area have also complained of health issues occasioned by the refuse. 
Bakare said, “We have made efforts to call on the government, most especially those in the area office close to us, to see ways they can help us to evacuate the refuse because it has deterred people from patronising the market because it is closer to the foodstuffs stand.
“Also, the refuse heap is about 20 metres away from houses across the market. If you get to our health centre, there are several reports of health issues, which have been linked to the refuse dump. Although the market activities come up every five days, the dangers of the odour coming from the market has put residents at health risks.”  Related News   Ogun approves 1,000 teachers’ recruitment  How my Chinese boyfriend abandoned me with his child - Ogun woman  Abiodun’s aide dismisses ex-LG boss’ allegation on fund diversion   
Bakare appealed to the state governor, Dapo Abiodun, and the local government authorities to come to their rescue by evacuating the refuse to save the community from airborne diseases and food poisoning.      
A community leader who identified herself simply as Mrs Amoleogun said that whenever it rains, the odour becomes unbearable for residents of the area.
“We are appealing to the government to come and help us to clear this refuse. We are at risk of diseases because of the odour that comes from the refuse heap especially when it rains. We have reached out to local authorities but nothing has been done,” She said.
The community youth leader, Adelaja Adeyinka, urged the government to come to the community’s rescue to avert the outbreak of diseases.
“The government should come and help us to evacuate this refuse so that cases of disease spread can be averted,” Adeyinka said.
The local government chairman, Sheriff Musa, did not respond to calls made to his line while the mobile of the Press Officer, Ogun State Ministry of Environment, Rotimi Oduniyi, was switched off as of the time of filing this report.",https://cdn.punchng.com/wp-content/uploads/2023/10/05234137/HEAP-OF-REFUSE.jpg
metro-plus,"Niger nabs, drags illegal wood loggers to mobile court",The Niger State Government said it collected N5m fine from some illegal wood loggers after they were arrested and arraigned in a mobile court. It said these illegal loggers took advantage of the large...,6th October 2023,https://punchng.com/niger-nabs-drags-illegal-wood-loggers-to-mobile-court/,Chika Otuchikere,"The Niger State Government said it collected N5m fine from some illegal wood loggers after they were arrested and arraigned in a mobile court.
It said these illegal loggers took advantage of the large wood deposit in the state to steal and take them to neighbouring states to sell, noting that most of the woods in Abuja and neighbouring states were stolen from Niger State.
The state Commissioner of Information, Binta Mammam, disclosed this on Thursday during a post-executive council meeting press briefing.
“On the issue of deforestation, the illegal logging activities happened around Mokwa Forest. Illegal wood loggers come from outside Niger State with their trucks and cart away our woods. That was when we quickly intervened. We dragged the suspects to a mobile court.  Related News   Niger bans LPG exports to Nigeria  Three victims escape from kidnappers in Niger  France's ambassador to Niger has left Niamey - report   
“Normally when these things happen, we call all the relevant stakeholders to give us an estimate of what the product is sold in the market. That happened last month. They were fined N5m which they paid,” she said.
The state Commissioner for Environment and Climate Change, Yakubu Kolo, represented by the ministry’s Permanent Secretary, Suraju Sa’eed, disclosed that the state government had concluded arrangements to plant 10 million trees across the state while the World Bank would partner with the state to increase it to 19 million trees.
This, he said, would boost the government’s proposed Green Economy. Kolo explained that deforestation had become a major challenge in the country and needed to be resolved at all costs, hence tree planting became necessary and important to curb the menace.",https://cdn.punchng.com/wp-content/uploads/2023/08/31192810/WhatsApp-Image-2023-08-31-at-19.27.31.jpeg
metro-plus,Police recover car stolen from Anambra in Lagos,"Men of the Zone 2 Police Command, Lagos have arrested a suspect, Ugomsinachi Maxwell, who allegedly belongs to a gang that specialises in snatching cars at gunpoint. He was said to have been arrested ...",6th October 2023,https://punchng.com/police-recover-car-stolen-from-anambra-in-lagos/,Amarachi Okeh,"Men of the Zone 2 Police Command, Lagos have arrested a suspect, Ugomsinachi Maxwell, who allegedly belongs to a gang that specialises in snatching cars at gunpoint.
He was said to have been arrested in Lagos while trying to sell a car he snatched in Anambra State.
The Zonal Police Public Relations Officer, Hauwa Adamu, disclosed this in a statement made available to journalists on Thursday.
According to Adamu, the suspects were trailed to a hotel in Ikorodu where they were set to sell off the car. 
She said a gun battle ensued and one of the suspected car snatchers, Udoye Somchukwu, died from the gunshot wound he suffered in the crossfire while two others escaped.
Adamu said the gang snatched a black Toyota Highlander SUV at gunpoint from a victim in Anambra State and moved it to Lagos for sale.  Related News   Lagos-Abeokuta expressway remains a death trap, motorists lament  Guards foil suspect’s attempt to raid Lagos bank  BRT bus crushes three to death in Lagos   
Following intelligence gathered by the men of the command, she said the Assistant Inspector General of the Police, Ari Ali, detailed operatives of the Zonal Raider Unit to investigate and confirm the veracity of the information.      
She added that the suspects were on September 22, 2023, trailed to Be Happy Hotel in Ita-Maga, Ikorodu, where the snatched vehicle was to be sold.
The statement read, “Upon sighting the police operatives, the suspected robbers engaged the operatives in a gun duel where one Udoye Sochukwu a.k.a. Daddy Seth who sustained a bullet wound was later confirmed dead by a doctor and the remain deposited at the morgue.
“One Ugomsinachi Maxwell was arrested unhurt, two other suspects escaped with bullet wounds, while one unregistered black Toyota Highlander 2003 model was recovered.
“The arrested suspect, a native of Enugu State who resides at No. 15, Olusesi Street, Ejigbo Lagos, when interrogated, claimed he only knew one of the fleeing suspects, Chidera, as a truck-pusher at Ladipo Spare Parts Market sometime in 2022.”
The statement noted that the suspect had been previously arrested for unlawful possession of firearms in April 2023.",https://cdn.punchng.com/wp-content/uploads/2023/10/05235951/ALI.jpg
metro-plus,BREAKING: Troops recover remains of slain Plateau Fulani leader,"Troops in Plateau State on Thursday disclosed that the remains of a Fulani leader in the Panyam district, Mangu Local Government Area of the state, Adamu Gabdo have been found. The PUNCH had reported ...",5th October 2023,https://punchng.com/breaking-troops-recover-remains-of-slain-plateau-fulani-leader/,James Abraham,"Troops in Plateau State on Thursday disclosed that the remains of a Fulani leader in the Panyam district, Mangu Local Government Area of the state, Adamu Gabdo have been found.
The PUNCH had reported that the Ardo of Panyam went missing on Sunday, September 24, 2023, but news reports had it that he was killed on Friday, September 22.
However, a few days later, the police said that the report at their disposal showed that Ardo who left Bauchi State on a visit to friends and relatives in Plateau State was only reported missing and not killed.
Since then, the disappearance of the Fulani leader has been causing tension in Mangu and the surrounding council areas. 
But a statement released on Thursday by the military taskforce in charge of maintaining peace in Plateau State confirmed that the remains of the Fulani leader were recovered in Bauchi State after a special operation.  Related News   Troops nab suspected abductors of Jos varsity students  Taskforce arrests two suspected kidnappers, 89 others in Plateau, Kaduna  BREAKING: Bandits kidnap Plateau pharmacists union leader   
The statement signed by a media officer of the military taskforce media, Captain Oya James, said “Following a Special Forces Tracking Operations conducted by troops of Operation SAFE HAVEN based on credible intelligence from well-meaning locals, the remains of the missing Fulani leader, Ardo Adamu Idris Gabdo, the Ardo Panyam have been discovered and recovered for burial.
“The troops conducted the operations in the early hours of today, 5 October 2033 and were able to identify and recover the remains of the body of the missing Ardo around Boi along Pankshin – Bauchi Road in Tafawa Balewa Local Government Area of Bauchi State. The body has since been handed over to the family for proper burial.      
“This breakthrough was made possible through the continued community engagements employed by OPSH. This remained key to the search operations, as troops worked closely with community leaders and critical stakeholders as well as family members of Ardo Adamu Gabdo to gather vital information and coordinate the search efforts. The steadfast collaboration between the leadership of Operation SAFE HAVEN and the communities also demonstrates the commitment and determination of both parties to ensure justice is served on the perpetrators.
It read further, “Consequently, the recovery of Ardo Adamu Idris Gabdo’s remains marks a significant step forward in unravelling the circumstances surrounding his disappearance. The investigation will now proceed with renewed vigor to identify and apprehend those responsible for this heinous crime and quickly bring them to justice as directed by the Chief of Army Staff. OPSH will continue to work tirelessly and stop at nothing to bring the perpetrators of all evil acts to justice and ensure the security of lives and property on the Plateau especially and the entire Joint Operations Area.
“The General Officer Commanding 3 Division Nigerian Army and Commander Operation SAFE HAVEN, Major General AE Abubakar while commending the special operation wishes to extend his heartfelt condolence to the family and loved ones of Ardo Adamu Idris Gabdo during this difficult time. He urges the general public to remain vigilant, cooperate with security agencies and provide any relevant information that may assist in the ongoing investigations. He further enjoined law-abiding citizens to join hands together to create a safe and secure environment for all residents devoid of criminal elements as he assured that justice will be served on anybody foundculpable.”",https://cdn.punchng.com/wp-content/uploads/2019/10/04170854/Bauchi-state-map-e1570205345340.png
metro-plus,Gunmen abduct embattled UNICAL law professor,"Gunmen on Thursday abducted the embattled Dean of Law Faculty, University of Calabar, Prof Cyril Ndifon. Ndifon, who had been suspended over allegations bordering on sexual harassment among others, wa...",5th October 2023,https://punchng.com/gunmen-abduct-embattled-unical-law-professor/,Idowu Abdullahi,"Gunmen on Thursday abducted the embattled Dean of Law Faculty, University of Calabar, Prof Cyril Ndifon. 
Ndifon, who had been suspended over allegations bordering on sexual harassment among others, was abducted by gunmen at his Akpabuyo residence in Akpabuyo Local Government Area of Cross River State.
The professor’s son, David Ndifon, confirmed his abduction to our correspondent. 
He said the gunmen invaded their residence, fired gunshots sporadically and also pointed gun at members of the family.   Related News   Kidnapped Benue commissioner rescued, no ransom paid - Gov  UNICAL lecturer accused of sexual harassment arrested  Sex Scandal: Why UNICAL Prof was arrested — DSS   
“It is true. He was taken away by gunmen. The incident happened between the hours of 11 p.m. on Wednesday and the early hours of Thursday.  
“We have been trying our best and making necessary calls to ensure his safe return,” David said. 
Ndifon had earlier raised the alarm that he was trailed to church premises by some masked men who also attempted to abduct him.",https://cdn.punchng.com/wp-content/uploads/2016/09/25192810/Prof.-Cyril-Ndifon.jpg
