category,title,excerpt,date,link,author,content,image
video,EXPLAINER: African migrants between life and death in Tunisia-Libya desert,"Tunisia, a major route for migration to Europe, has come under scrutiny after the Libyan border guards told the media that, over the past two weeks, they have rescued hundreds of migrants who said the...",9th August 2023,https://punchng.com/explainer-african-migrants-between-life-and-death-in-tunisia-libya-desert/,Our Reporters,"Tunisia, a major route for migration to Europe, has come under scrutiny after the Libyan border guards told the media that, over the past two weeks, they have rescued hundreds of migrants who said they were left by Tunisian authorities in the border region near Al-Assah, about 150 kilometres (90 miles) west of Tripoli, with no food or water.
Following the death of a Tunisian man in a clash between locals and migrants, hundreds of migrants from sub-Saharan African countries have been driven out of the Tunisian port city of Sfax and dumped at the border with Algeria and Libya without food or water.
Sfax, Tunisia, is only about 130 kilometres from the Italian island of Lampedusa. The North African country is a gateway for migrants and asylum-seekers attempting perilous sea voyages in hopes of a better life in Europe.  Related News   Over 900 migrants trying to cross Mediterranean die, missing — UN  UN decries violations of migrants' rights  Awoniyi eyes African goals record   
According to a report published by Human Rights Watch, many asylum-seekers had been severely beaten, some had been tortured, and the women were subject to sexual violence.
Watch our explainer to learn more about African migrants who are between life and death in the Tunisia-Libya desert.",
video,How removal of fuel subsidy pushed me into robbing passengers- Lagos e-hailing driver,"A 29-year-old Lagos State e-hailing driver and accounting graduate, Adeniran Jerimiah, was arrested for robbing a female passenger. Jerimiah was arrested in a shop in the Ikotun area of the state whil...",7th August 2023,https://punchng.com/how-removal-of-fuel-subsidy-pushed-me-into-robbing-passengers-lagos-e-hailing-driver/,Our Reporters,"A 29-year-old Lagos State e-hailing driver and accounting graduate, Adeniran Jerimiah, was arrested for robbing a female passenger.
Jerimiah was arrested in a shop in the Ikotun area of the state while trying to purchase an item. He was recognised by one of his former victims who was in the same shop at that particular time and alerted the public.  Related News   Fuel subsidy is organised crime - Obi  TUC concludes NEC meeting, to meet FG shortly  Nigerians need good governance, not palliatives - ex-UNIOSUN VC   
He claimed the hike in fuel price as a result of the removal of fuel subsidy pushed him into robbing.",
video,"Homeless Ogun woman gives birth by roadside, hides baby in container","A homeless woman, identified as Aminat Adekunle, was, on Friday, delivered of a baby girl by the roadside in the Arepo area of Ogun State. Still smarting from the afterbirth pains and looking pale, sh...",6th August 2023,https://punchng.com/homeless-ogun-woman-gives-birth-by-roadside-hides-baby-in-container/,Our Reporters,"A homeless woman, identified as Aminat Adekunle, was, on Friday, delivered of a baby girl by the roadside in the Arepo area of Ogun State.
Still smarting from the afterbirth pains and looking pale, she was seen by our correspondent cradling the sleeping newborn in a container littered with her belongings.  Related News   Lift ban on NURTW, Ogun Assembly tells Abiodun  Shun cultism, Ogun  ex-deputy gov urges youths  Ogun community seeks gov’s help over flooded road   
The PUNCH learnt that the 36-year-old went into labour at about midnight and gave birth without any form of assistance from anyone.
It was further gathered that Aminat went on to hide the unclothed baby in a container belonging to a logistics company located nearby.",
video,"So This Happened (215) reviews death of Lagos medical doctor, others","In this episode of So This Happened, we reviewed how a Japanese man, Toco, transformed himself into a canine after splashing more than $14,000 on a custom-made collie costume. We also reviewed the dea...",5th August 2023,https://punchng.com/so-this-happened-215-reviews-death-of-lagos-medical-doctor-others/,Our Reporters,"In this episode of So This Happened, we reviewed how a Japanese man, Toco, transformed himself into a canine after splashing more than $14,000 on a custom-made collie costume.
We also reviewed the death of a medical doctor, Dr Vwaere Diaso, who died on Tuesday at the General Hospital, Odan, Lagos Island, after an elevator she took suddenly crashed and landed on the ground floor.  Related News   Lagos-Abeokuta expressway remains a death trap, motorists lament  Guards foil suspect’s attempt to raid Lagos bank  BRT bus crushes three to death in Lagos   
Lastly, we discussed how the former Governor of Rivers State, Nyesom Wike, promised that President Bola Tinubu will not regret nominating him as a ministerinhiscabinet.",
sports,Oyebanji apologises to Ekiti athletes over NYG ‘embarrassment’,"Ekiti State Governor, Biodun Oyebnji, has apologised to the state’s athletes at the just-concluded 2023 National Youths Games in Asaba, Delta State over the shabby manner they were treated by the Ek...",6th October 2023,https://punchng.com/oyebanji-apologises-to-ekiti-athletes-over-nyg-embarrassment/,Abiodun Nejo,"Ekiti State Governor, Biodun Oyebnji, has apologised to the state’s athletes at the just-concluded 2023 National Youths Games in Asaba, Delta State over the shabby manner they were treated by the Ekiti State Sports Council officials.
The Governor, who spoke in Ado Ekiti during a reception for the athletes on Wednesday evening, said the incident had strengthened the state government’s resolve to develop sports, and assured the youngsters and their coaches of financial rewards.
Oyebanji said the officials embarrassed the athletes, their parents, Ekiti people at home and abroad and the state generally.
The athletes, described as “Great Ekiti Ambassadors,” won a total of seven medals — two gold, two silver and three bronze — at the Games.


  
Ekiti athletes were kitted in all sorts of unbefitting wears during the march past for the opening of the games in what has been described as an embarrassing situation which went viral and attracted criticisms.
Addressing the athletes, Oyebanji said, “Let me start on the note of apology to you for the indiscretion and the inappropriate behaviour of the officials of the sports council.
“As a government, we tried our best to provide for you, but the officials, for reasons best known to them, decided to act inappropriately. As a government, I accept responsibility for this, not because I support those that decided to act in ways and manners that have brought embarrassment to you and to all Ekiti indigenes all over the world, but as the Governor of Ekiti State.        Related News   Youth Games end today in Asaba  Delta police engage kidnappers in gun duel, kill four  Delta pastor kills girl   
“I apologise to all Ekiti indigenes for the embarrassment caused by the sports council officials to all of us and I hope you accept my apology but I can assure you that justice will be served.”
The Governor, who lauded the young athletes for their “impressive performances”, assured them of government’s support to attain greater heights in their respective areas of specialisation.
He said, “I know you were not well fed there. I have photos of where you slept, but I thank God it happened. If it had not happened, we would not have paid attention to you. In adversities, there are lessons. What happened has strengthened our resolve to reposition sports in the state.”
Oyebanji added that the bill for the establishment of the state’s sports commission recently signed by the state House of Assembly would be passed within two weeks.
He said, “We are going to pay special attention to sports and the vehicle we are going to use is the sports commission, adding that “efforts are in top gear to set up indoor games centres in the state next year.”
The Governor said the Oluyemi Kayode Stadium in Ado Ekiti, as well as other stadia in Ikere, Ijero and Ikole, would soon be given facelift, saying his administration would leave no stone unturned in its quest to maximise the potential of young talents in sports and other fields.
Oyebanji also assured the athletes and coaches at the Youth Games that they would get cash rewards, and hailed his wife, Dr Olayemi Oyebanji and wife of former Governor, Erelu Bisi Fayemi, for their intervention and invaluable contributions towards coming to the aid of the athletes in Asaba.",https://cdn.punchng.com/wp-content/uploads/2023/03/07151408/Oyebanji.jpg
sports,FIFA best awards,"Osimhen makes final 12-man shortlist, Oshoala out Nigerian striker, Victor Osimhen, made the final 12-man shortlist for The Best FIFA Men’s Player of The Year award, PUNCH Sports Extra reports. The ...",6th October 2023,https://punchng.com/fifa-best-awards/,Johnny Edward,"Osimhen makes final 12-man shortlist, Oshoala out
Nigerian striker, Victor Osimhen, made the final 12-man shortlist for The Best FIFA Men’s Player of The Year award, PUNCH Sports Extra reports.
The list, which was released by the world football body on Thursday, had the Napoli forward as the only African still in the race for the most coveted football individual prize, after his compatriot, Asisat Oshola, failed to make the final shortlist for the women’s category of the prestigious awards.
The qualifying period for the prize is between December 19, 2022 and August 10, 2023, with nominees including Argentina captain Lionel Messi, Frenchman Kylian Mbappe and Norwegian Manchester City striker Erling Haaland.


  
Within this period, Osimhen scored 29 goals while helping Napoli to win the Serie A title for the first time in over three decades. He also emerged as last season’s Serie A top scorer and was named in the league’s Team of The Season.
Other players on the shortlist are Kevin De Bruyne, Julian Alvarez, Marcelo Brozovic, Ilkay Gundogan, Rodrigo Cascante, Khvicha Kvaratskhelia, Declan Rice and Bernado Silva.  Related News   TikTok row: Osimhen rejects Napoli penalty duty  FIFA appoints referees, VAR officials for Super Eagles, Saudi Arabia friendly  Medical experts raise concerns over doping introduction in NPFL   
Meanwhile, other players shortlisted by FIFA for the award in the women’s category are Oshoala’s Barcelona Femini teammates, Jennifer Hermoso and Aitana Bonmati.      
Others are Linda Caicedo, Rachel Daly, Kadidiatou Diani, Caitlin Foord, Mary Fowler, Alex Greenwood, , Lindsey Horan, Amanda Ilestedt, Lauren James, Sam Kerr, Mapi León, Hinata Miyazawa, Salma Paralluelo and Keira Walsh.
Also, African goalkeepers Andre Onana and Yassine Bounou from Cameroon and Morocco respectively made the final five-man list for The Best FIFA Men’s Goalkeeper award.
Bounou won the 2022/23 UEFA Europa League with Sevilla and was named in the competition’s Team of The Season, while Onana won the 2022 Supercoppa Italiana and the Coppa Italia with Inter Milan.
Other contenders for the keeper’s award are Thibaut Courtois, Ederson Santana de Moraes and Marc-André ter Stegen.",https://cdn.punchng.com/wp-content/uploads/2023/03/01040846/Osimhen-and-Oshoala.jpg
sports,TikTok row: Osimhen rejects Napoli penalty duty,"Nigerian striker Victor Osimhen has taken himself off penalty-taking duty for Napoli after a now infamous series of TikToks were posted to the club’s social media channels in recent weeks, PUNCH Spo...",6th October 2023,https://punchng.com/tiktok-row-osimhen-rejects-napoli-penalty-duty/,Peter Akinbo,"Nigerian striker Victor Osimhen has taken himself off penalty-taking duty for Napoli after a now infamous series of TikToks were posted to the club’s social media channels in recent weeks, PUNCH Sports Extra reports.
The Nigerian had been left furious after two seemingly insulting videos were posted to the club’s TikTok account, one of which had mocked him as begging for a penalty then his miss from the spot in a Serie A match against Bologna at the end of September.
The videos caused an uproar for Osimhen and his supporters alike, eventually leading to the departure of one of Napoli’s social media executives.
Since the incident, Napoli have played three matches and been awarded penalties in every one of those games, yet Osimhen has not taken any of them.


    Related News   FIFA best awards  UCL: Unfortunate Meret hands Madrid win at Napoli  Osimhen commits to Napoli despite row   
Instead, Piotr Zielinski took on the responsibility against Udinese as well as against Real Madrid in Wednesday night’s Champions League clash at the Maradona.
Matteo Politano took the injury-time kick against Lecce in the game that was played between the two aforementioned fixtures.
According to reports from La Repubblica, reported via TMW, it was Osimhen himself who decided to take himself off penalty duty, having felt unnecessarily mocked by the club’s social media team.      
Osimhen had scored two of the three spot-kicks he took in Serie A during the title-winning 2022/23 season, and had scored one of the two he had taken in the early stages of the 2023/24 campaign.",https://cdn.punchng.com/wp-content/uploads/2023/10/03125032/Victor-Osimhen-22-e1696333832334.jpeg
sports,‘Joshua would have knocked out Tyson’,"Former boxing world heavyweight champion Larry Holmes has said British-Nigerian boxer Anthony Joshua would have knocked out the legendary Mike Tyson when he was in his prime. Holmes, who held the worl...",6th October 2023,https://punchng.com/joshua-would-have-knocked-out-tyson/,Peter Akinbo,"Former boxing world heavyweight champion Larry Holmes has said British-Nigerian boxer Anthony Joshua would have knocked out the legendary Mike Tyson when he was in his prime.
Holmes, who held the world title from 1978 until 1985, was once a Tyson victim when he was knocked out in the fourth round of their title fight in New Jersey January 22, 1988.
Now 73, the International Boxing Hall of Fame and World Boxing Hall of Fame inductee and only man to defeat Muhammad Ali by stoppage, is making a bold claim for Joshua.
Holmes believes that the fellow former champion would have been able to knock Tyson out in his prime.


  
Joshua is a two-time former unified world heavyweight champion, having held the World Boxing Association super, International Boxing Federation and World Boxing Organization titles.  Related News   Joshua told to chase titles not Wilder fight  Joshua training with former Fury coach  ‘Joshua punches like Mike Tyson’   
Tyson (50-6-2, 44 knockouts) is regarded as arguably the greatest fighter in boxing, gaining notoriety for his early knockout wins and intimidating aura.
“If he fought a guy like Mike Tyson, he’d win, he would have knocked out a prime Mike Tyson. There’s no reckon about it. Mike Tyson went down low and then came up and tried to throw roundhouses. But Joshua would just hit him with a straight right hand on the side of his damn chin and Mike wouldn’t get up,” Holmes said.      
“He never fought anyone who was coming up and trying to make their way in the sport. He just went in there – bang, bang, bang and knocked everyone out. That’s how he got the reputation as a puncher.
“I’m not taking anything away from Mike Tyson, he kicked my a**. But I was out for two years, I had quit boxing, I hadn’t done anything for two years apart from sing with the band and travel.”",https://cdn.punchng.com/wp-content/uploads/2023/10/05214157/JOSHUA-AND-TYSON.jpg
sports,Okowa backs MTN CHAMPS to unearth new talents,"The President, Athletics Federation of Nigeria, Tonobok Okowa, has promised technical support for the maiden MTN CHAMPS athletics championships, PUNCH Sports Extra reports. Over 7,000 athletes and 500...",6th October 2023,https://punchng.com/okowa-backs-mtn-champs-to-unearth-new-talents/,Johnny Edward,"The President, Athletics Federation of Nigeria, Tonobok Okowa, has promised technical support for the maiden MTN CHAMPS athletics championships, PUNCH Sports Extra reports.
Over 7,000 athletes and 500 schools are set to compete for over 1,000 medals and 32 team titles at the championships, sponsored by telecommunications giants MTN and organised by Making of Champions, in partnership with the Nigeria School Sports Federation.
The competition, which is spread across three age brackets — the cadets (U-14), youths (U-17) and juniors (U-20), will be held in four cities across the country — Benin City, Ibadan, Uyo and Abuja.
The championship holds from October 12 to 14 in Benin and in Uyo from October 26 to 28. In Ibadan, the MTN CHAMPS takes place from November 9 to 11, while in Abuja it will hold from November 29 to December 1, with the grand finale in Abuja slated for December 2.


    Related News   7,000 athletes battle for 1,000 medals at MTN CHAMPS  Okowa rules out tenure extension  Okowa wants NYG trophy as gift from Team Delta   
“I am the main beneficiary of this championship because there are no proper competitions for these age cadre and MoC has just rescued us from that challenge through the MTN CHAMPS,” Okowa told PUNCH Sports Extra.
“The athletes will look forward to these competitions and will train towards them, because sometimes we lose the athletes between 15 and 18 because no good competitions to keep them going. We at the AFN will give the competition every support it needs.”
On his part, founder, MoC, Bambo Akani, highlighted the benefits of staging the MTN CHAMPS.      
He said, “I am pleased that we now have MTN identifying with our efforts to take track and field to lofty heights in Nigeria. This is indeed a monumental turning point in our country’s history in school sports and in athletics. I have the conviction that MTN CHAMPS will unearth and foster athletics talents across the
country.”",https://cdn.punchng.com/wp-content/uploads/2023/10/05213917/OKOWA.jpg
sports,"Adesanya, Strickland rematch in doubt – White",UFC President Dana White has cast some doubts over the title rematch between Israel Adesanya and Sean Strickland. Strickland shocked the world last time out when he dominated Adesanya to capture the m...,6th October 2023,https://punchng.com/adesanya-strickland-rematch-in-doubt-white/,Peter Akinbo,"UFC President Dana White has cast some doubts over the title rematch between Israel Adesanya and Sean Strickland.
Strickland shocked the world last time out when he dominated Adesanya to capture the middleweight title. Following his win, there was a wide consensus that ‘The Last Stylebender’ would get an immediate rematch, but that may no longer be the case.
While speaking to the media at the Contender Series press conference on Wednesday, White shed some doubt on the middleweight championship bout.
According to the UFC CEO, another rising challenger in the weight class could force his way into contention.


  
“I mean, that fight (between Strickland and Adesanya) just happened. A couple of fights are going to play out here now over the next month or so and then we’ll go from there and figure out what’s next,” he said.  Related News   Love lost!  Adesanya posted worst display against Strickland – Du Plessis  White confirms Adesanya title rematch   
“Whatever the best fight to make when all is said and done, and who’s injured, who’s not injured, who can go, what time, where, you know? There’s a lot of different factors that play into what we’re going to do next.”
The middleweight division is stacked with a number of high-level contenders who are all hoping to be called for the next shot at UFC gold. Dricus du Plessis is the obvious standout, beating all six of his opponents inside the octagon.      
Du Plessis was originally meant to meet Adesanya in the cage this year but was replaced with Strickland when he refused the fight date due to injury. The South African may now jump ahead of the rest of the competitors to get his shot at the champion.
There are also some huge matchups set to take place later this year that may shape the future of the division. No.4 ranked Jared Cannonier will welcome Roman Dolidze into the cage in a battle between two powerhouses December 2.
Another fight at middleweight will see Khamzat Chimaev make his return to the weight class when he collides with Paulo Costa later this month. ‘Borz’ has already called out champion Strickland and hopes a win at UFC 294 October 21 secures him a title shot.",https://cdn.punchng.com/wp-content/uploads/2023/10/05213655/ADESANYA-AND-STRICKLAND.jpg
sports,"D’Tigress battle US, Belgium, Senegal for Olympic slot","African champions D’Tigress will face Senegal, US and Senegal at the 2024 FIBA Women’s Olympic Qualifying Tournament, PUNCH Sports Extra reports. The draws, which took place in Hungary on Thursday...",6th October 2023,https://punchng.com/dtigress-battle-us-belgium-senegal-for-olympic-slot/,Ebenezer Bajela,"African champions D’Tigress will face Senegal, US and Senegal at the 2024 FIBA Women’s Olympic Qualifying Tournament, PUNCH Sports Extra reports.
The draws, which took place in Hungary on Thursday, had the Nigerians drawn in Tournament 2, which will be held in Antwerp, Belgium from February 8, 2024.
D’Tigress were seeded in Pot 3 due to their 11th ranked position in the world, and would hope to join the United States, who have already qualified as the World Cup winners.
The draw, which is for four women’s basketball tournaments, will be contested by 16 national teams, where the top teams earn a place in the 2024 Summer Olympics basketball tournament.


  
There are 10 Olympic tickets available since France are already assured of their spot as the Olympic hosts and US as the last FIBA Women’s world champions in 2022.  Related News   Why I dumped goalkeeping for basketball -- Ugoka  Eze:  Baby D’Tigress star hungry for success  Rivers Assembly to honour D'Tigress head coach, two others   
Both have a guaranteed spot in Paris but will take part in the qualifying tournaments.
As determined by the FIBA Central Board’s decision September 9, the FIBA Women’s Olympic Qualifying Tournaments will be held from February 8 to 11, 2024 in four cities, namely Antwerp, Belgium; Belem, Brazil; Sopron, Hungary; and a city to be confirmed in China.      
In tournament 1, France are paired with China, New Zealand and the yet-to-be-decided qualifiers from the Americas. In tournament 3, Brazil, Germany, Serbia and Australia will slug it out for a spot at the Olympics.
Meanwhile, Spain, Hungary, Japan and the other qualifier from the Americas region will hope to pick up one of the tickets from the group.
The teams from the Americas are Canada, Puerto Rico, Colombia and Venezuela.",https://cdn.punchng.com/wp-content/uploads/2021/09/26233611/DTigress.jpg
sports,Squash: Top stars for Prime Atlantic Open,"Nigeria’s top squash players have been listed to feature at the second Prime Atlantic Squash Open, PUNCH Sports Extra reports. The tourney, according to the organisers, serves off from October 31 to...",6th October 2023,https://punchng.com/squash-top-stars-for-prime-atlantic-open/,Johnny Edward,"Nigeria’s top squash players have been listed to feature at the second Prime Atlantic Squash Open, PUNCH Sports Extra reports.
The tourney, according to the organisers, serves off from October 31 to November 4 at the Teslim Balogun Stadium, Lagos.
Onaopemipo Adegoke, Gabriel Olufunmilayo, Kehinde Samuel, Abel Shedrack, Faruq Sulaimon, Samson Ashade, Dominion Utukpe and Temiloluwa Adegoke are some of the players billed to feature in the male category, while in the ladies category Rophiat AbdulAzeez, Busayo Olatunji, Blessing Isaac, Favour Utukpe, Mistura Durosinlorun, Udeme James, Titilayo Akinleye and Jadesola Olatunji will compete for honours.
Our correspondent learnt that the tournament is approved by the Professional Squash Association and is expected to improve players’ world rankings.


  
Speaking with our correspondent, the Chairman, Lagos State Squash Association, Tomi Falase, said, “Organising regular tournament is good for the players but making it a PSA-approved championship is the icing on the cake. Prime Atlantic and the LSSA is ready to hold the second edition.  Related News   
“What this tournament will do is to improve the rankings of our players internationally; it will put them on the same pedestal to make their mark like the legendary Jahangir Khan and the Jonathan Power of this world.
“This second edition promises to be an exciting one, the players are in top form because they’ve had regular competitions of recently. So, it’s going to be the battle of the fittest,” Falase said.      
The Tournament Director, Wasiu Sanni, also added that the essence of the tournament was to avail players the opportunity to be competitive.
“Training without putting what you have learnt into practice is an effort in futility, and we as the custodians of these players need to observe them and know where they need improvement.
“I’m excited about what’s to come, Prime Atlantic has been a great partner in progress and I hope these players make the best of this opportunity.”",https://cdn.punchng.com/wp-content/uploads/2023/10/06005634/Squash-Top-stars-for-Prime-Atlantic-Open.jpg
