category,title,excerpt,date,link,author,content,image
politics,"Rivers tribunal: Fubara dedicates victory to God as APC, LP vow to appeal","The Rivers State Governor, Siminalayi Fubara, has described the verdict by the state governorship election petitions tribunal that upheld his election as the beginning of the confirmation of the trust...",3rd October 2023,https://punchng.com/rivers-tribunal-fubara-dedicates-victory-to-god-as-apc-lp-vow-to-appeal/,Dennis Naku,"The Rivers State Governor, Siminalayi Fubara, has described the verdict by the state governorship election petitions tribunal that upheld his election as the beginning of the confirmation of the trust expressed in him by the Rivers people.
The governor also dedicated his victory to God and his predecessor, the current Minister of the Federal Capital Territory, Nyesom Wike.

Fubara stated this while speaking at a brief thanksgiving service held at the Chapel of Everlasting Grace, Government House, Port Harcourt on Monday night. 
A statement issued on Tuesday morning by the media aide to the governor, Boniface Onyedi, said the service was attended by some members of the State Executive Council and political leaders.
Fubara restated his commitment not to disappoint the expectations of Rivers people during his administration.
He explained that the place of God in his administration would not be compromised, saying this explained why they had gathered to thank Him for his unceasing direction and guidance, which made his emergence as governor possible at the polls that has now been affirmed by the tribunal.      

“No matter how brief it is, it is just to say thank you to God our Father, thank you to God His Son and thank you to the Holy Spirit who directs and guides us.
“And to also say that God will always pass through somebody to make things happen. I want to appreciate our principal who stood behind me; who has created this opportunity with the help of every one of you here to say a big thank you.”  Related News   Slain DPO: Police closing in on prime suspect—Rivers CP  Explosion: I'll no longer tolerate illegal bunkering - Rivers monarch  Rivers: 35 feared dead in illegal oil refining explosion   
The governor who solicited more support to the administration also enjoined Rivers people to be patient with his government as it delivers good governance that will make their lives better.
Meanwhile, the All Progressives Congress and the Labour Party in the state have vowed to appeal the judgement of the tribunal. The APC governorship candidate in the election said he would study the ruling with his legal team and take the necessary steps.
Tonye Cole
Cole also faulted one of the grounds of the tribunal that the party in the state had hitherto withdrawn from the matter.
He stated, “I really will like to see what the judges stood on to make their decisions.        
“The main case that the APC withdrew and as a result of that my own rights were infringed upon, I don’t agree with that. The law allows me to continue with the case up to the Supreme Court.”
Similarly, the deputy governorship candidate of the LP, Sam Kinane, said,” We won’t end it here. We will not be able to let Nigerians feel the pain of the robbing that was done in the elections.
“One thing I keep telling people whether we get the kind of justice that we expected or not, if we do not take the matter to court, it would say, ‘yes we were waiting but they did not come.’”
Continuing, he said, “Now that we have taken it to the court and have showed every available evidence they have come with nullification. So, we are still going to take it to the Supreme Court and let’s also hear from them.”
The Rivers State Election Petitions Tribunal sitting in Abuja had on Monday dismissed the petition filed by the LP and the APC against the victory of Fubara as governor of the state.
LP’s Beatrice Itubo and APC’s Cole had approached the tribunal to challenge the victory of the PDP’s Fubara.",https://cdn.punchng.com/wp-content/uploads/2023/10/03130525/Siminalayi-Fubara-2-e1696334724526.jpeg
politics,Why APC NWC members visited Buhari- Ganduje,"The National Chairman of the All Progressives Congress, Abdullahi Ganduje, has explained why he led a delegation of National Working Committee members to see the immediate past president of Nigeria, M...",3rd October 2023,https://punchng.com/why-apc-nwc-members-visited-buhari-ganduje/,Adebayo Folorunsho-Francis,"The National Chairman of the All Progressives Congress, Abdullahi Ganduje, has explained why he led a delegation of National Working Committee members to see the immediate past president of Nigeria, Muhammadu Buhari, in Katsina State.
Ganduje and his team visited the former President in his home town, Daura, on Monday.
Buhari, Ganduje and some other members of the APC NWC
In a statement issued in Abuja by his Chief Press Secretary, Edwin Olofu, the former governor of Kano state said he went to formally introduce the new leadership of the APC to the former president and to rejoice with him on the occasion of Nigeria’s 63rd Independence anniversary.
He said, “It is mainly to introduce the newly constituted National Working Committee of our great party. And also to show to him our solidarity and to thank him for what he has done for the country in eight years.   Related News   Tinubu, drive sustainable livestock reform  Buhari greets Tinubu, Nigerians on Independence Day  Nigeria@63: Ganduje urges Nigerians to sustain faith in Tinubu   
“To also congratulate him on the Independence Day celebration, 63 years of development for Nigeria for which eight years must be a portion for his administration. That is why we are here in Daura at his residence, and we thank him for receiving us.”
Speaking on the victories of the APC in some of the Tribunal judgments delivered so far, the National Chairman said: “Of course, seeing is believing and we are happy and comfortable. But that is not enough.
“We have three off-season elections coming up in Kogi, Bayelsa and Imo. Insha Allah, we will also win these elections. So, we are happy with the developments.”      
The national chairman and other NWC members on his entourage have since returned from Daura to the Federal Capital Territory.",https://cdn.punchng.com/wp-content/uploads/2023/10/03124304/Why-APC-NWC-members-visited-Buhari.jpeg
politics,APC stakeholders slam NNPP for protesting Kano tribunal judgment in London,"Stakeholders of the All Progressives Congress, on Monday, knocked the New Nigeria People’s Party for protesting the judgment of Kano Election Petitions Tribunal in the United Kingdom, stressing ...",2nd October 2023,https://punchng.com/apc-stakeholders-slam-nnpp-for-protesting-kano-tribunal-judgment-in-london/,Adebayo Folorunsho-Francis,"Stakeholders of the All Progressives Congress, on Monday, knocked the New Nigeria People’s Party for protesting the judgment of Kano Election Petitions Tribunal in the United Kingdom, stressing that the judiciary cannot be intimidated.
The tribunal had sacked Kano Governor, Abba Yusuf, on September 20 and affirmed the candidate of APC, Nasiru Gawuna, as winner of the contentious March 18 governorship election.
The London demonstration led by a chieftain of the NNPP, Dr Aminu Bello, took place in front of Nigeria’s Embassy.
The eight-man procession converged at the embassy on Sunday morning chanting solidarity songs and displaying different placards that read “Kano must not be robbed”, “Tinubu should allow Justice to prevail in Kano” and “Keep politics out of our courts” among others. 
Reacting, some chieftains of the APC under the aegis of National Coalition of APC Progressives Stakeholders described the demonstration as a cheap attempt to blackmail the judiciary, especially on a day the nation is celebrating its 63rd Independence Day anniversary.  Related News   Why Amaechi hijacked Rivers APC — Ex-aide  Atiku's press conference gross contempt of Supreme Court — APC  Tribunal: Nasarawa APC rejects Sule's sack   
Addressing newsmen in Abuja on Monday, the National Secretary of the coalition, Isabella Odunayo, expressed disappointment that the NNPP and the Kwankwasiyya Movement could only find eight willing members to deploy for their protest.
She said, “After failed attempts to discredit the tribunal ruling, the NNPP desperation took them to London where it sponsored a protest to blackmail the Federal Government and discredit the tribunal judgement, unknowingly to the organisers, Nigerians in the diaspora had watched clips of the jubilation that trailed the APC victory at the tribunal thereby Nigerians in London ignored the sponsored protest.      
“It is shameful that Abba Yusuf and the Kwankwasiyya Movement only got eight persons for a protest which targeted about one thousand people, a sign that Nigerians both at home and in Diaspora accepted the judgment in good faith. The NNPP should be aware that, the judiciary can not be intimidated by its threat as security agencies in Nigeria are fully prepared to secure the Country. The eight people led by Dr Aminu Bello who embarrassed themselves yesterday in London do not represent the interest of Nigerians.
“It is barbaric and indeed archaic for the NNPP to toe the part of blackmail calling for justice in faraway London when justice has already been served with the judgment of the tribunal. It is unpalatable to speak ill of the judiciary because your stealing antics were uncovered. It is by such actions that some desperate politicians may desist from rigging and instilling violence during elections. But We are optimistic that the Appeal Court judges shall also deliver judgementonitsmerit.”",https://cdn.punchng.com/wp-content/uploads/2021/08/15102107/APC-flag.jpg
politics,Umahi commends Mbah for ending sit-at-home in Enugu,"The Minister of Works, Mr David Umahi, has thanked Governor Peter Mbah of Enugu State for ending the sit-at-home order enforcement in the state. The former governor of Ebonyi State and Chairman of the...",2nd October 2023,https://punchng.com/umahi-commends-mbah-for-ending-sit-at-home-in-enugu/,Raphael Ede,"The Minister of Works, Mr David Umahi, has thanked Governor Peter Mbah of Enugu State for ending the sit-at-home order enforcement in the state.
The former governor of Ebonyi State and Chairman of the South-East Governors’ Forum, spoke when he inspected the collapsed bridge at the Enugu-Port Harcourt Expressway, according to a statement by his media officer on Monday.
Umahi described the end of the sit-at-home in Enugu as a major step forward for the region.
“Let me thank you for being able to courageously stop sitting at home in Enugu State. It is a major thing you have done for the Igbo. It is a major thing you have done for the country,” he said. 
He alsocongratulated Mbah on his victory at the Enugu State Governorship Election Petition Tribunal, while advising the opposition in the state to stop wasting their time contesting Mbah’s divine and people’s mandate.
Umahi, who is a member of the All Progressives Congress, said it was not about the party, but about the quality of the individual Enugu people had chosen to lead them.
The minister said that Mbah’s initiative to commence the reconstruction and dualisation of the Enugu – Abakaliki federal road up to the Ebonyi boundary was another display of people-driven leadership by a private sector person in governance.      
He added, “I am happy that you came from the private sector. There is a very serious high hope by the steps you have rolled out. They are in tandem with Mr. President’s steps and I pledge to support him very seriously and I also pledge to support you. There must be a change. We must reset the country.
“I want to publicly say while congratulating you on the tribunal victory, that whoever is taking you to the court must stop wasting their time, as you are the people’s choice and for good reasons.
“So, we will continue to support and pray for you, and I urge whoever is distracting you that they should understand the step of God and know that you are divine and we are very proud of you.”
“When a man wants to engage in public affairs, you should find out about his background. You are a very successful private person and you are going to bring it to bear in this governance of Enugu State. And this Enugu is the pride of the entire South-East and of course, the EastCentralState.”",https://cdn.punchng.com/wp-content/uploads/2023/06/01193425/PETER-MBAH-1.jpg
politics,Kogi gov: APC seeks justice for slain party member,"As the November 11 governorship election in Kogi State draws closer, the All Progressives Congress has vowed to pursue justice for its member killed during the campaign rally of the Social Democratic ...",2nd October 2023,https://punchng.com/kogi-gov-apc-seeks-justice-for-slain-party-member/,Gbenga Odogun,"As the November 11 governorship election in Kogi State draws closer, the All Progressives Congress has vowed to pursue justice for its member killed during the campaign rally of the Social Democratic party in the Konto-Nkarfe area of the state.
The spokesman/Director, Media and Publicity, Kogi APC Governorship Campaign Council, Kingsley Fanwo, said this in a press conference on Monday in Lokoja.
He added that the party was working closely with the security agencies to ensure that the perpetrators of the killing of an unarmed young lady were not only brought to book also to ensure that no act of criminality or violence would be tolerated before, during and after the November 11 election.
“We have invited you today to brief you on certain developments as we race to November 1 1, 2023. Chief among them was the gruesome murder of an unarmed woman at Kotonkarfe. While we commiserate with the family and the entire people of Kotonkarfe, we call on security agencies to ensure that those who killed her have undoubtedly declared war on the Nigerian state, whose responsibility it is to protect the poor woman who was killed by bullets from the barrels of the SDP rifles,” he said.   Related News   Why Amaechi hijacked Rivers APC — Ex-aide  Atiku's press conference gross contempt of Supreme Court — APC  Tribunal: Nasarawa APC rejects Sule's sack   
Fanwo said that it was on record that the SDP candidate already admitted that the Commissioner of Police was not aware of his rally.
He described the rally as “an ambush on the peace-loving people of Kotonkarfe.”
He called on the supporters of the party to remain calm as security agencies were trusted to ensure that the killers would be apprehended.      
“The Kogi State APC campaign council will await the full reports of the security agencies,”henoted.",https://cdn.punchng.com/wp-content/uploads/2023/05/21011927/APC.jpeg
politics,A’Ibom APC gov candidate plans to appeal tribunal judgment,"***says judgement shocking The governorship candidate of the All Progressives Congress in Akwa Ibom State, Obong Akanimo Udofia, has announced the decision of his party to appeal the judgement of the ...",2nd October 2023,https://punchng.com/akwa-ibom-apc-gov-candidate-plans-to-appeal-tribunal-judgement/,Patrick Odey,"***says judgement shocking
The governorship candidate of the All Progressives Congress in Akwa Ibom State, Obong Akanimo Udofia, has announced the decision of his party to appeal the judgement of the Election Petitions Tribunal.
The three-man panel led by Justice Adekunle Adeleye, last week, dismissed the APC candidate’s petition on the grounds that the allegations of substantial noncompliance with the electoral law in the conduct of the elections were not sufficiently proved by the petitioner.
But in a statement issued on Sunday night, in Uyo, Akwa Ibom State, Udofia said the decision of the tribunal regarding the outcome of the March 18, 2023 governorship election was shocking, unjust and unacceptable, adding that the APC in the state was disappointed as to how the “tribunal arrived at those outcomes in the face of glaring evidence of infractions on the Electoral Act and the 1999 Constitution”. 
He said, “On Thursday, 28th September 2023, the Akwa Ibom State Governorship Election Petition Tribunal dismissed our Petition filed against the declaration of Pastor Umo Eno as Governor of Akwa Ibom State by the Independent National Electoral Commission.
“Given this judgement, I am guided by an overwhelming sense of social responsibility and commitment to upholding the principles of democracy, good governance and shared prosperity to Akwa Ibom people to issue this statement.
“The decision by the Akwa Ibom Governorship Election Petitions Tribunal regarding the outcome of the March 18, 2023 governorship election is shocking, unjust and unacceptable.        Related News   13-hour PEPT judgment raises more dust, exposes petitions’ loopholes  Mbang spoke his mind to power, say Obasanjo, Eno  NEMA, NIMET, NIHSA collaboration will avert disaster management mistakes — Gov. Eno   
“We are disappointed, and at a loss as to how the Tribunal arrived at those outcomes in the face of glaring evidence of infractions on the Electoral Act and the 1999 Constitution.
“I firmly believe that our electoral process should be a reflection of the will of the people, and we must protect and preserve the integrity of that process.
“It is with this commitment to the people of Akwa Ibom State and the principles of democracy that we announce our intention to appeal the decision of the Election Petition Tribunal at the Court of Appeal.”
Udofia, who noted that he would continue to uphold the rule of law and respect for the judiciary, expressed confidence that the appeal would give a fair hearing.
“In our quest to recover our stolen mandate, we will continue to uphold the rule of law, respect the judiciary, and remain steadfast in our belief that justice will ultimately prevail. We have faith in the legal system, and we are confident that our appeal will be given a fair and impartial hearing,” he said.
He called on his supporters to remain calm and law-abiding as he moved forward with the appeal.",https://cdn.punchng.com/wp-content/uploads/2023/10/02104126/Obong-Akanimo-Udofia.jpg
politics,APC chieftain hails Abiodun over tribunal victory,"A chieftain of the All Progressives Congress and member of the National Working Committee, Tolu Bankole, on Sunday congratulated Ogun State governor, Dapo Abiodun, after the state election petitions t...",2nd October 2023,https://punchng.com/apc-chieftain-hails-abiodun-over-tribunal-victory/,Adebayo Folorunsho-Francis,"A chieftain of the All Progressives Congress and member of the National Working Committee, Tolu Bankole, on Sunday congratulated Ogun State governor, Dapo Abiodun, after the state election petitions tribunal upheld his victory in the March 18 governorship poll.
The chieftain also congratulated his deputy, Noimot Oyedele-Salako, the state chapter of APC and the people of Ogun State on the victory.
Abiodun’s victory as declared by the Independent National Electoral Commission was upheld by the tribunal on Saturday.
Delivering the 11-hour judgment, the Chairman of the Tribunal, Hamidu Kunaza, said the petitioner, the Peoples Democratic Party governorship candidate in the election, Ladipupo Adebutu, and his party failed to prove their case beyond reasonable doubt. 
Adebutu had asked the tribunal to quash Abiodun’s victory for not complying with the Electoral Act of 2022, corrupt practices and for not being qualified to have contested the 2023 governorship election in the state.  Related News   Nigeria’s housing deficit is widening  Why Amaechi hijacked Rivers APC — Ex-aide  Atiku's press conference gross contempt of Supreme Court — APC   
In a statement issued in Abuja on Sunday, Bankole described the judgment as a revalidation of the people’s mandate to continue the ‘Igbega Ipinle Ogun’ agenda of Abiodun’s administration till 2027. The APC chieftain also admonished the governor’s critics and members of the opposition to work toward delivering the dividend of democracy to the people.
He said, “This judgment has again deepened our nation’s jurisprudence and reinforced our commitment to democratic values. As true democrats, we must embrace the tents of democracy which also encompass post election litigations. The State Election Petition Tribunal has delivered justice. Now is the time to unite for the progress of Ogun State.      
“I urge the opposition to sheath their swords and join hands with our Governor to develop our dear Gateway state. The tribunal verdict should be accepted in good faith by all lovers of democracy. Our commitment to advancing Ogun State must be anchored on prioritising our collective progress above personal vendetta.
“Since our collective vision is shaped by our passion for a prosperous Ogun State, let us, therefore, embrace the will of the people and support the Governor Dapo Abiodun in delivering on his Igbega Ogun mandate.
“Let us desist from all divisive politics and comments, by ensuring that no individual’s ambition should endanger the progress of Ogun State which is the priority of Governor Dapo Abiodun since inception. Again, congratulations to His Excellency Prince Dapo Abiodun and Noimot Oyedele-Salako.”",https://cdn.punchng.com/wp-content/uploads/2023/06/03140301/Tolu-Bankole.jpg
